Product name,Brand Name,Serving Size (ml),Protein per Serving (g),Price (INR),Protein Per Rupee,Protein Type,Calories per Serving,Sugar (g),Added Flavours,,Digestibility Rating (out of 5),Country of origin,AminoAcid Profile,Certifications
Amul Protein Shake,Amul,200,20,50,0.4,Milk Protein,140,3,Yes,,4.3,India,Complete Dairy Amino Acid Profile,FSSAI
Epigamia Turbo Protein Milkshake,Epigamia,250,26,150,0.173333333333333,Whey Protein,170,4,Yes,,4.4,India,Complete Whey Amino Acid Profile,FSSAI
Raw Protein Milkshake,Raw,200,18,100,0.18,Whey Protein,150,3,Yes,,4.2,India,Complete Whey Amino Acid Profile,FSSAI
Yoga Bar Protein Shake,Yoga Bar,250,26,120,0.216666666666667,Whey + Milk Protein,160,5,Yes,,4.1,India,Complete Dairy Amino Acid Profile,FSSAI
Provilac High Protein,Provilac,250,26,130,0.2,Whey Protein Isolate,200,2,Yes,,4.5,India,Complete Whey Amino Acid Profile,FSSAI
Phab Protein Milkshake,Phab,200,18,130,0.138461538461538,Whey Protein,180,3,Yes,,4.3,India,Complete Whey Amino Acid Profile,FSSAI
Nuvie Protein Milkshake,Nuvie,250,20,120,0.166666666666667,Plant Protein (Pea + Almond),170,4,Yes,,4,India,Plant Amino Acid Blend,FSSAI
